{
  "external_publication_or_DOI_created": false,
  "files": [
    {
      "path": "configs/stage10_rudy.yaml",
      "sha256": "b4bdb2bf728866d493475fe95d5b555ab4e3635bfad59f6f4675fd695dd73712",
      "size_bytes": 5276
    },
    {
      "path": "data/manifests/stage2/reference_sources.csv",
      "sha256": "7ec1cd4a7659c711b19b6e19fda6284289409862984ee0ee9c65e6766915f197",
      "size_bytes": 841
    },
    {
      "path": "data/manifests/stage2/rudy_kepler_products.csv",
      "sha256": "ffe68fba9e12fdd0b0a030adfe627952f34fb70b99a7efd3112b10e5dac9cff7",
      "size_bytes": 8403
    },
    {
      "path": "data/manifests/stage2/rudy_tess_products.csv",
      "sha256": "a03decc22193d335659f16fe9b68053c0345623c580c786c9197f2dfc15e44bc",
      "size_bytes": 27838
    },
    {
      "path": "data/reference/frequency_ratios.csv",
      "sha256": "34a09d9a199b7c023a38f20e18fbc132bf43504c4c6ef0518720924aa4166ab3",
      "size_bytes": 8807
    },
    {
      "path": "data/reference/mode_frequencies.csv",
      "sha256": "fce9491ddce070502652386f4b649baf89ca118db4477a3527f982ecfc7cf901",
      "size_bytes": 9396
    },
    {
      "path": "data/reference/stellar_references.csv",
      "sha256": "d119e19e4329da20d5a5b3353c68c95e42f2a3d9b043b42ab00766c798e81586",
      "size_bytes": 75821
    },
    {
      "path": "docs/protocols/STAGE10_RUDY_FREEZE_PROTOCOL.md",
      "sha256": "a950833f791a3d55e1851a335da1193952e5c6972ec703bb12774eb309686cc3",
      "size_bytes": 8209
    },
    {
      "path": "docs/reproducibility/STAGE10_REPRODUCTION.md",
      "sha256": "ba947322f5d114eb15ee38f2315e374175c0c23cdd425e1d9d119f275429f78f",
      "size_bytes": 3570
    },
    {
      "path": "docs/source_documents/topological_asteroseismology_references.bib",
      "sha256": "0baeda1f501e00916204f7d58d9045401d6d90f42d0ec44a6f8b0e42841c5fca",
      "size_bytes": 14889
    },
    {
      "path": "paper1/README.md",
      "sha256": "d07d32b5e1d0f63ac398c10a4c5a414cf6305231803473610bda5dc7c8b16233",
      "size_bytes": 1003
    },
    {
      "path": "paper1/additional_references.bib",
      "sha256": "1b51d293e8d3de1aeca0f938f756d1d88c80653ee30a3a4ba103788dfe655448",
      "size_bytes": 451
    },
    {
      "path": "paper1/build_status.json",
      "sha256": "af649af086165c395adf02e3b82f20da1e63e9f4abb1de04a6d2fa3f0cbc07f3",
      "size_bytes": 297
    },
    {
      "path": "paper1/claim_ledger.tex",
      "sha256": "3479678e66c24b6540a4af986a624983e3e54c47af798ce3d3be81a4aae2db8e",
      "size_bytes": 1909
    },
    {
      "path": "paper1/main.pdf",
      "sha256": "b30169bf3bbadb325dbb540bb5efd51a40f79b4b80f023713c410f0bcf365b82",
      "size_bytes": 632907
    },
    {
      "path": "paper1/main.tex",
      "sha256": "fc8ea94f6a04a6b0f17e72e7ad491a3e26282f790f8d41bdcad3e952f53ce8a6",
      "size_bytes": 24306
    },
    {
      "path": "paper1/manuscript_template.tex",
      "sha256": "fc8ea94f6a04a6b0f17e72e7ad491a3e26282f790f8d41bdcad3e952f53ce8a6",
      "size_bytes": 24306
    },
    {
      "path": "paper1/references.bib",
      "sha256": "27aa6b784a565e3110203dd3e76776b43c08db0a7a05e55c8d8b904731616966",
      "size_bytes": 15341
    },
    {
      "path": "paper1/results_macros.tex",
      "sha256": "4e07c556889a4e315913104bc8c1812a89f57004ecac4aa10e7378569bedd6c2",
      "size_bytes": 476
    },
    {
      "path": "paper1/results_tables.tex",
      "sha256": "2fc449138704fe312cc4597b1e66088ed9bedc8557f08a032d017c6744274925",
      "size_bytes": 2082
    },
    {
      "path": "pyproject.toml",
      "sha256": "efeada29a78841e65da2fac03d39e8fdb093702116d6d851bc3048c48d72e55b",
      "size_bytes": 2035
    },
    {
      "path": "registries/preprocessing_branches.csv",
      "sha256": "2c6ddfdd5e958e5ebdaf9bc850dae30d8376b0f66c1357f2181fbbfabb503f2e",
      "size_bytes": 2065
    },
    {
      "path": "reports/stage10/LIMITATIONS_AND_NEGATIVE_RESULTS.md",
      "sha256": "34f61089e59ffb6ffc1e78247bd82dad80c0e7b0f3fff4fde29c8529984dcd9a",
      "size_bytes": 2582
    },
    {
      "path": "reports/stage10/STAGE10_REPORT.md",
      "sha256": "e2b32d29df8cc778237f953d9a01c493f9c25876534a7d23f4071af4c3103299",
      "size_bytes": 2387
    },
    {
      "path": "reports/stage10/TRACEABILITY_MATRIX.md",
      "sha256": "d3e3168678731922aaae569ffcba4419ddebfe2736b36b33ac7d5398ad4ea16f",
      "size_bytes": 2260
    },
    {
      "path": "reports/stage10/claim_audit.json",
      "sha256": "d3c729cc04b984b8129123598409805c82121971ed380f8209a7189bc67fc4ca",
      "size_bytes": 396
    },
    {
      "path": "reports/stage10/claim_evidence.csv",
      "sha256": "c8b39adfd28a2de0a2bdf30eaed1f976ec68568d2196ee3ecaf1b061a77ea1d6",
      "size_bytes": 2582
    },
    {
      "path": "reports/stage10/figure_manifest.json",
      "sha256": "a9a7dcf9599b1644ac552338ce10b84e08dd506e686f47b46a1803c7fcc60c6e",
      "size_bytes": 4886
    },
    {
      "path": "reports/stage10/figures/01_observation_window.pdf",
      "sha256": "dae31e4371cd520d57c3ca57a48a666003ddf08bec675e4f2091c5ce72b76858",
      "size_bytes": 51543
    },
    {
      "path": "reports/stage10/figures/01_observation_window.png",
      "sha256": "e395d121b1ac3546d3fcbdcfd4af7e5a84ef32a5f00a9ca8510a6776bbdf6f77",
      "size_bytes": 211896
    },
    {
      "path": "reports/stage10/figures/01_observation_window.svg",
      "sha256": "77b305f7820f3ce6886f699c365d6537abbd1de0569893d108488f7c082870ef",
      "size_bytes": 141479
    },
    {
      "path": "reports/stage10/figures/02_psd_background.pdf",
      "sha256": "0f54c63c07125cf56bdb9ad4d4a52bbac56dbd2e1a3fd44aa61655ee3ce5e9b8",
      "size_bytes": 64545
    },
    {
      "path": "reports/stage10/figures/02_psd_background.png",
      "sha256": "0171bbb0a84314deae004437bd4628b74645dd982c59331f6ecf01031ae80b06",
      "size_bytes": 146036
    },
    {
      "path": "reports/stage10/figures/02_psd_background.svg",
      "sha256": "c8f555c4d16505e2487a7f28010b441af3b68989839cd0dbca9bbddcef67cb26",
      "size_bytes": 184056
    },
    {
      "path": "reports/stage10/figures/03_ordinary_echelle.pdf",
      "sha256": "3b4f5d41c20301201d5b9a023993d226221baae579f1987c6e38898b1e219acf",
      "size_bytes": 23827
    },
    {
      "path": "reports/stage10/figures/03_ordinary_echelle.png",
      "sha256": "9193b6ed54bfb316502a2d2711b5f50aa051d4c9233a981ee999c599af3e170d",
      "size_bytes": 70511
    },
    {
      "path": "reports/stage10/figures/03_ordinary_echelle.svg",
      "sha256": "6137e58a73d0a8b7cd0a3f57d9e6380803c86b7d735cc4e914f09edefeb235f3",
      "size_bytes": 65414
    },
    {
      "path": "reports/stage10/figures/04_localized_persistence.pdf",
      "sha256": "b2474a3c38ea76139f34ada20c26d845bd778b9d9816a2341d9cd8abc5b0ea3b",
      "size_bytes": 22362
    },
    {
      "path": "reports/stage10/figures/04_localized_persistence.png",
      "sha256": "bf6a4c0f52b5c3ab513d5433e52b5ac9d0f2150a6f2139175fd5860b4d00b593",
      "size_bytes": 127976
    },
    {
      "path": "reports/stage10/figures/04_localized_persistence.svg",
      "sha256": "869205df544f5ac3c3f155fb6a9214b9a5fd942c54e6290414ef55d5d145901d",
      "size_bytes": 137374
    },
    {
      "path": "reports/stage10/figures/05_spacing_aliases.pdf",
      "sha256": "2fa445733aa2403ca302dce3348f9c4b682b73891b6bb57e7eecab356300ec02",
      "size_bytes": 20350
    },
    {
      "path": "reports/stage10/figures/05_spacing_aliases.png",
      "sha256": "bfe95b78b3fdbff7c3e77d7b8feb1a7d650280f3deca054ca0fcc30becaa7707",
      "size_bytes": 162764
    },
    {
      "path": "reports/stage10/figures/05_spacing_aliases.svg",
      "sha256": "2b264eafe9dc4686fc0a75bcb1733dde85c6adaef02d79e83c34858ab947d548",
      "size_bytes": 82881
    },
    {
      "path": "reports/stage10/figures/06_cylinder_ridges.pdf",
      "sha256": "b9de6beb50d671d39ccc400cebe6b8b3f03d74d64b3db5b923cf3985a8189a9a",
      "size_bytes": 36426
    },
    {
      "path": "reports/stage10/figures/06_cylinder_ridges.png",
      "sha256": "4f4336b1bb9403104a12af45fc9c665c43f7034d5344969c036229833df6c0cb",
      "size_bytes": 193286
    },
    {
      "path": "reports/stage10/figures/06_cylinder_ridges.svg",
      "sha256": "872fdaab759fe44084fc313391bbc960d0fa199b2b95d47c50c7d78d7a5fb616",
      "size_bytes": 141513
    },
    {
      "path": "reports/stage10/figures/07_simulation_placement.pdf",
      "sha256": "281befe892c5c6e3309ba79cd8bb326881bcacaa260200c867cbbf32f1bdb2c6",
      "size_bytes": 16597
    },
    {
      "path": "reports/stage10/figures/07_simulation_placement.png",
      "sha256": "d4cc6c5a0091ab0c98d39784c1895912b56f210f1d8a703bb0857b92016af6df",
      "size_bytes": 73750
    },
    {
      "path": "reports/stage10/figures/07_simulation_placement.svg",
      "sha256": "69e88bbe7a00884745ed58dbfa31988a5ea885842e49d737f123674dce5b4807",
      "size_bytes": 90012
    },
    {
      "path": "reports/stage10/figures/08_sensitivity_uncertainty.pdf",
      "sha256": "483b795b0ac63cfa91359cfc6a490fa60093b2aad0331b470fb258cd793b633f",
      "size_bytes": 14300
    },
    {
      "path": "reports/stage10/figures/08_sensitivity_uncertainty.png",
      "sha256": "1213a32b380a76b23e91c2ef74423393f99da3f1373e6bef8259ce20477036f3",
      "size_bytes": 57922
    },
    {
      "path": "reports/stage10/figures/08_sensitivity_uncertainty.svg",
      "sha256": "9acc32fbc77c63753baf20e8725f761427cd26c416ae11e8dda6f340cf475991",
      "size_bytes": 58568
    },
    {
      "path": "reports/stage10/figures/09_quarter_stability.pdf",
      "sha256": "cff18dae7724cac7b4bbd5ecc737adbdfc1671e81df7cc6f4c560ad173854a65",
      "size_bytes": 14996
    },
    {
      "path": "reports/stage10/figures/09_quarter_stability.png",
      "sha256": "53deff77c9a6f1c0bc4656480166be39c692d81edc233723dac7adfcaaca2a42",
      "size_bytes": 101931
    },
    {
      "path": "reports/stage10/figures/09_quarter_stability.svg",